{"active_cohort_constructive_repair":"FORBIDDEN","admission_cutoff_utc":"2026-08-27T12:50:00Z","assignment_git_identity":"7f44170cafcf4f2a3e432d42df43fce5e72416b6","assignment_id":"PS-BRANCH-CAL-BR-013-v25-087c1604-r2","behavioral_config_projection":["task_id","title","prompt_sha256","normalized_schedule","timing_mode","default_timezone","enabled","execution_mode","preactivation_inactive_result"],"candidate_nonce":"b097a8fecd88d939d91d39fddce98e54db4ff56c3c7711513ee0fa0c918278e6","cohort_id":"CAL-BR-013-v25-087c1604-r2","control_manifest_git_identity":"acb890aad721be8a76cf9d7dce57b62ed1ccfcda","control_manifest_id":"CTRL-CAL-BR-013-v25-087c1604-r2","generation_branch":"ps/gen/CAL-BR-013-v25-087c1604-r2","generation_root_sha":"087c1604e6d4ecce6222e0da7cc36cbe7b21e8ab","liveness_git_identity":"81849f992d02ced9d79d153508a7efd8babc7566","max_attempt_duration_seconds":600,"mutable_runtime_fields_excluded":["last_error","last_result","last_run_time","next_run_time","updated_at"],"production_not_before_utc":"2026-08-27T13:00:00Z","protocol_version":"2.5","raw_auth_material_publication":"FORBIDDEN","runtime_state_id":"9d0a88cc9001295b5e4c0f4163e83c0fd64ce04521e34230ad3539af14f3dfaf","scheduler_cadence_seconds":3600,"scheduler_jitter_budget_seconds":60,"schema_version":"PS-SCHEDULER-MANIFEST-2.5-2","stage_admit_promote":"THREE_DISTINCT_TRANSACTIONS","task_network_plan_id":"0aa341106cfc5b104ab9ca9c2ae116d490a258685e28d26d5435860c53bb12aa","task_registry_git_identity":"a44f60c09eff09f59d87a356225e1898f8e3d33c","tasks":[{"behavioral_config_sha256":"5f4a72be459d57a0cf68b9ea04d35292443eec8f4c052b197ea4ac2ff07475ab","canonical_title":"PS-MF-W01 | Representation Lab","challenge_occurrences_utc":["2026-08-27T10:05:00Z","2026-08-27T11:05:00Z"],"default_timezone":"America/Vancouver","enabled":true,"execution_mode":"SAFE_REPLAY_ONLY","normalized_first_production_utc":"2026-08-27T13:05:00Z","normalized_schedule":"TZID=America/Vancouver;FREQ=HOURLY;BYMINUTE=05","normalized_second_production_utc":"2026-08-27T14:05:00Z","preactivation_branch":"ps/preactivate/CAL-BR-013-v25-087c1604-r2/MF01","preactivation_inactive_result":"PREACTIVATION_WAIT","preactivation_path":"preactivation/CAL-BR-013-v25-087c1604-r2/MF01.json","production_branch":"ps/work/CAL-BR-013-v25-087c1604-r2/MF01","production_path":"reports/CAL-BR-013-v25-087c1604-r2/MF01.json","prompt_sha256":"a44b7b4b84eb1cf55abe9db77a663047556e59a013e40b74e3a9a2d4f00678ab","role_id":"MF01","scheduler_task_id":"6a8416348c848191b6b4908fea710e9f","timing_mode":"exact_schedule","worker_auth_commitment":"bd987e12b67ee0a859a95ffd8f697c86889dc122834382d9abd768832a25d0b8"},{"behavioral_config_sha256":"7e84259d39aeb1d34a9b770746580c02c27e94a2756646b00d4dbf7a29916aa8","canonical_title":"PS-MF-W02 | E1 Solver Routing","challenge_occurrences_utc":["2026-08-27T10:06:00Z","2026-08-27T11:06:00Z"],"default_timezone":"America/Vancouver","enabled":true,"execution_mode":"SAFE_REPLAY_ONLY","normalized_first_production_utc":"2026-08-27T13:06:00Z","normalized_schedule":"TZID=America/Vancouver;FREQ=HOURLY;BYMINUTE=06","normalized_second_production_utc":"2026-08-27T14:06:00Z","preactivation_branch":"ps/preactivate/CAL-BR-013-v25-087c1604-r2/MF02","preactivation_inactive_result":"PREACTIVATION_WAIT","preactivation_path":"preactivation/CAL-BR-013-v25-087c1604-r2/MF02.json","production_branch":"ps/work/CAL-BR-013-v25-087c1604-r2/MF02","production_path":"reports/CAL-BR-013-v25-087c1604-r2/MF02.json","prompt_sha256":"d4b3e00c2380b7865e8ef5ce8619a954ac01f8932ca5a04a2b6b337e20bfbab5","role_id":"MF02","scheduler_task_id":"6a84163cd4fc81918b57cf7a25923976","timing_mode":"exact_schedule","worker_auth_commitment":"9958e0db188517442f5b317e45ee8073de58e9b1f88bf09352635e77cde63b17"},{"behavioral_config_sha256":"fc8f93fd10e31fbb397573d141b1ea0f793801f1f4f81c0e1df0df2ed8c55593","canonical_title":"PS-MF-W03 | Lemma & Operator Lab","challenge_occurrences_utc":["2026-08-27T10:07:00Z","2026-08-27T11:07:00Z"],"default_timezone":"America/Vancouver","enabled":true,"execution_mode":"SAFE_REPLAY_ONLY","normalized_first_production_utc":"2026-08-27T13:07:00Z","normalized_schedule":"TZID=America/Vancouver;FREQ=HOURLY;BYMINUTE=07","normalized_second_production_utc":"2026-08-27T14:07:00Z","preactivation_branch":"ps/preactivate/CAL-BR-013-v25-087c1604-r2/MF03","preactivation_inactive_result":"PREACTIVATION_WAIT","preactivation_path":"preactivation/CAL-BR-013-v25-087c1604-r2/MF03.json","production_branch":"ps/work/CAL-BR-013-v25-087c1604-r2/MF03","production_path":"reports/CAL-BR-013-v25-087c1604-r2/MF03.json","prompt_sha256":"d96768737f672980f3627e8a887d3fbfbc84cedf9e69ba6bd858d1c54e525f77","role_id":"MF03","scheduler_task_id":"6a84164563ec8191ac9a0902622eb676","timing_mode":"exact_schedule","worker_auth_commitment":"cdc7710036cca8874730b36c47e03023698fd5c79c6383327c61dd01b6b85e4c"},{"behavioral_config_sha256":"d4167fa6d6088261c5df275c98fc81366657b4bcf800c9f54a0711189b560c32","canonical_title":"PS-MF-W04 | Adversarial Falsifier","challenge_occurrences_utc":["2026-08-27T10:08:00Z","2026-08-27T11:08:00Z"],"default_timezone":"America/Vancouver","enabled":true,"execution_mode":"SAFE_REPLAY_ONLY","normalized_first_production_utc":"2026-08-27T13:08:00Z","normalized_schedule":"TZID=America/Vancouver;FREQ=HOURLY;BYMINUTE=08","normalized_second_production_utc":"2026-08-27T14:08:00Z","preactivation_branch":"ps/preactivate/CAL-BR-013-v25-087c1604-r2/MF04","preactivation_inactive_result":"PREACTIVATION_WAIT","preactivation_path":"preactivation/CAL-BR-013-v25-087c1604-r2/MF04.json","production_branch":"ps/work/CAL-BR-013-v25-087c1604-r2/MF04","production_path":"reports/CAL-BR-013-v25-087c1604-r2/MF04.json","prompt_sha256":"19362bd1f8f9058bbf0500be79cb658de34c4755692d6993f512cbcab7966261","role_id":"MF04","scheduler_task_id":"6a84164c7bb0819192e2750f51587099","timing_mode":"exact_schedule","worker_auth_commitment":"47c507c6241d66ef9660f02153682a8a792cec5853ad605a853d862ea29b399e"},{"behavioral_config_sha256":"136f988804ad1462ce2b8ed27c4b27334277d6874029b908b5a08cb67c2e8c11","canonical_title":"PS-MF-W05 | Product Closure","challenge_occurrences_utc":["2026-08-27T10:09:00Z","2026-08-27T11:09:00Z"],"default_timezone":"America/Vancouver","enabled":true,"execution_mode":"SAFE_REPLAY_ONLY","normalized_first_production_utc":"2026-08-27T13:09:00Z","normalized_schedule":"TZID=America/Vancouver;FREQ=HOURLY;BYMINUTE=09","normalized_second_production_utc":"2026-08-27T14:09:00Z","preactivation_branch":"ps/preactivate/CAL-BR-013-v25-087c1604-r2/MF05","preactivation_inactive_result":"PREACTIVATION_WAIT","preactivation_path":"preactivation/CAL-BR-013-v25-087c1604-r2/MF05.json","production_branch":"ps/work/CAL-BR-013-v25-087c1604-r2/MF05","production_path":"reports/CAL-BR-013-v25-087c1604-r2/MF05.json","prompt_sha256":"e92e8b6ee5c31094fed0bdd790c837bf22961e09bf6e6f18d66213470325b80e","role_id":"MF05","scheduler_task_id":"6a8416576c288191b31eb63a52854388","timing_mode":"exact_schedule","worker_auth_commitment":"f88773930b4b9ffeb2c4a892245776dd86928bf83b606a6b14d5af46031b6150"},{"behavioral_config_sha256":"8550b3bddb286c37ef762a5c5396e69e5f49ddfb18d6cb859ef9c2f0a177e49a","canonical_title":"PS-MM-W01 | React Mechanisms","challenge_occurrences_utc":["2026-08-27T10:10:00Z","2026-08-27T11:10:00Z"],"default_timezone":"America/Vancouver","enabled":true,"execution_mode":"SAFE_REPLAY_ONLY","normalized_first_production_utc":"2026-08-27T13:10:00Z","normalized_schedule":"TZID=America/Vancouver;FREQ=HOURLY;BYMINUTE=10","normalized_second_production_utc":"2026-08-27T14:10:00Z","preactivation_branch":"ps/preactivate/CAL-BR-013-v25-087c1604-r2/MM01","preactivation_inactive_result":"PREACTIVATION_WAIT","preactivation_path":"preactivation/CAL-BR-013-v25-087c1604-r2/MM01.json","production_branch":"ps/work/CAL-BR-013-v25-087c1604-r2/MM01","production_path":"reports/CAL-BR-013-v25-087c1604-r2/MM01.json","prompt_sha256":"419270d9932bd48a82c3dd9a041c3ad1e65847602dd97f047726a1e4801bc7ab","role_id":"MM01","scheduler_task_id":"6a84166107d48191aaa2d95880e3b19e","timing_mode":"exact_schedule","worker_auth_commitment":"24d9c4036d7169bcc9168800d94fd0b546edd43f150da3f1c0e8b7279bcba7af"},{"behavioral_config_sha256":"690b1bf69b08a069c56ad338adffeb38c79a9ce6d77f1a38bbd51811f40adcfb","canonical_title":"PS-MM-W02 | DeepSWE Mechanisms","challenge_occurrences_utc":["2026-08-27T10:11:00Z","2026-08-27T11:11:00Z"],"default_timezone":"America/Vancouver","enabled":true,"execution_mode":"SAFE_REPLAY_ONLY","normalized_first_production_utc":"2026-08-27T13:11:00Z","normalized_schedule":"TZID=America/Vancouver;FREQ=HOURLY;BYMINUTE=11","normalized_second_production_utc":"2026-08-27T14:11:00Z","preactivation_branch":"ps/preactivate/CAL-BR-013-v25-087c1604-r2/MM02","preactivation_inactive_result":"PREACTIVATION_WAIT","preactivation_path":"preactivation/CAL-BR-013-v25-087c1604-r2/MM02.json","production_branch":"ps/work/CAL-BR-013-v25-087c1604-r2/MM02","production_path":"reports/CAL-BR-013-v25-087c1604-r2/MM02.json","prompt_sha256":"a81d5a90e82ca2245da43de7f3bedd010ba9e6f0a61502130e3382bf0cdadb6c","role_id":"MM02","scheduler_task_id":"6a84166713ac819185e377ef68a73788","timing_mode":"exact_schedule","worker_auth_commitment":"1f811bf3613881652321191b59118e271c998f141aaa52f2c36be50c5ccad7d4"},{"behavioral_config_sha256":"7d7f95782f71cbe1190c8dbc305ca65d0fae9305d0d2648688b8c3e6ed130a41","canonical_title":"PS-MM-W03 | SlopCode Contracts","challenge_occurrences_utc":["2026-08-27T10:12:00Z","2026-08-27T11:12:00Z"],"default_timezone":"America/Vancouver","enabled":true,"execution_mode":"SAFE_REPLAY_ONLY","normalized_first_production_utc":"2026-08-27T13:12:00Z","normalized_schedule":"TZID=America/Vancouver;FREQ=HOURLY;BYMINUTE=12","normalized_second_production_utc":"2026-08-27T14:12:00Z","preactivation_branch":"ps/preactivate/CAL-BR-013-v25-087c1604-r2/MM03","preactivation_inactive_result":"PREACTIVATION_WAIT","preactivation_path":"preactivation/CAL-BR-013-v25-087c1604-r2/MM03.json","production_branch":"ps/work/CAL-BR-013-v25-087c1